{
  "schema_version": 1,
  "approval_id": "33333333-3333-4333-8333-333333333333",
  "proposal_id": "11111111-1111-4111-8111-111111111111",
  "phase": "execute",
  "proposal_revision": 1,
  "payload_hash": "025b6f8ab0826324bbcbc4d2d3d7e92a492735931c4543639bb96e043726475c",
  "decision": "approve",
  "device_id_hash": "bbbbbbbbbbbbbbbbbbbbbbbbbbbbbbbbbbbbbbbbbbbbbbbbbbbbbbbbbbbbbbbb",
  "decided_at": "2026-08-26T10:05:00.000Z",
  "has_replacement": false
}
